{"content_digest":"c51bd7dd1921b36283eb077b2cca0a6f625c17607ba9075e942b900658179564","lifecycle_state":"active","payload":{"authority_effect":"none","candidate_kind":"expression","code_digest":"01015c7cb161f4f4b3b8c054b4215c22ca9b7cf771cb6362a72cc980aba1da32","contract_version":"contentmd.learning-record-contract/0.1.0","feature_profile_version":"rank-features/0.1.0","features":[{"missing_indicator_name":null,"name":"project_match","nullable":false,"position":0,"transformation":"exact equality","value_type":"boolean"},{"missing_indicator_name":null,"name":"product_area_match","nullable":false,"position":1,"transformation":"exact equality","value_type":"boolean"},{"missing_indicator_name":null,"name":"journey_state_match","nullable":false,"position":2,"transformation":"exact equality","value_type":"boolean"},{"missing_indicator_name":null,"name":"channel_match","nullable":false,"position":3,"transformation":"exact equality","value_type":"boolean"},{"missing_indicator_name":null,"name":"locale_match","nullable":false,"position":4,"transformation":"exact equality","value_type":"boolean"},{"missing_indicator_name":null,"name":"risk_match","nullable":false,"position":5,"transformation":"exact equality","value_type":"boolean"},{"missing_indicator_name":"required_fact_coverage_missing","name":"required_fact_coverage","nullable":true,"position":6,"transformation":"distinct satisfied / applicable","value_type":"number"},{"missing_indicator_name":null,"name":"required_fact_coverage_missing","nullable":false,"position":7,"transformation":"applicable set empty","value_type":"boolean"},{"missing_indicator_name":"recovery_action_coverage_missing","name":"recovery_action_coverage","nullable":true,"position":8,"transformation":"distinct satisfied / applicable","value_type":"number"},{"missing_indicator_name":null,"name":"recovery_action_coverage_missing","nullable":false,"position":9,"transformation":"applicable set empty","value_type":"boolean"},{"missing_indicator_name":"approved_terminology_ratio_missing","name":"approved_terminology_ratio","nullable":true,"position":10,"transformation":"distinct satisfied / applicable","value_type":"number"},{"missing_indicator_name":null,"name":"approved_terminology_ratio_missing","nullable":false,"position":11,"transformation":"applicable set empty","value_type":"boolean"},{"missing_indicator_name":"contextual_entity_coverage_missing","name":"contextual_entity_coverage","nullable":true,"position":12,"transformation":"distinct satisfied / applicable","value_type":"number"},{"missing_indicator_name":null,"name":"contextual_entity_coverage_missing","nullable":false,"position":13,"transformation":"applicable set empty","value_type":"boolean"},{"missing_indicator_name":"contextual_action_coverage_missing","name":"contextual_action_coverage","nullable":true,"position":14,"transformation":"distinct satisfied / applicable","value_type":"number"},{"missing_indicator_name":null,"name":"contextual_action_coverage_missing","nullable":false,"position":15,"transformation":"applicable set empty","value_type":"boolean"},{"missing_indicator_name":"supporting_evidence_coverage_missing","name":"supporting_evidence_coverage","nullable":true,"position":16,"transformation":"distinct satisfied / applicable","value_type":"number"},{"missing_indicator_name":null,"name":"supporting_evidence_coverage_missing","nullable":false,"position":17,"transformation":"applicable set empty","value_type":"boolean"},{"missing_indicator_name":null,"name":"generic_language_density","nullable":false,"position":18,"transformation":"covered generic token positions / tokens","value_type":"number"},{"missing_indicator_name":"length_distance_missing","name":"length_distance","nullable":true,"position":19,"transformation":"normalized distance to grapheme range","value_type":"number"},{"missing_indicator_name":null,"name":"length_distance_missing","nullable":false,"position":20,"transformation":"no length range","value_type":"boolean"}],"forbidden_input_fields":["actor_identity","author_identity","protected_class","inferred_emotion","inferred_vulnerability","presentation_side","presentation_order","provider_alternative_order","decision","post_decision_outcome","browser_expression","competitor_expression","third_party_expression"],"input_digest":"5e6ca2d986b4feb367339cf99ded7b55d876a5bd948e3faea87948fb5548569f","profile_state":"frozen","ranking_objective":"expression_preference","record_mode":"development_fixture","runtime_profile_ref":{"artifact_digest":"eef23dc9f2e6c1dcd46201291758d07f400d834e24076e2bc4beb451ae526696","artifact_id":"contentmd.feature-source-runtime-profile","artifact_version":"0.1.0"},"schema_digest":"1a62cf5af7a7a58dd0e5f16d472a860e1754edce5a646877207fafac333f0e57","source_artifact_refs":[{"artifact_digest":"128391f02a63e52b4d1dabfe3f12e06e4c40ff2059f932a6555c0cc5fe82f693","artifact_id":"unicode-word-break","artifact_version":"17.0.0"},{"artifact_digest":"1d45af3473c7df9cb80d73dff29c7f03cd63ff217788e327dcb164713a5a0c0f","artifact_id":"unicode-whitespace","artifact_version":"17.0.0"},{"artifact_digest":"20713609c69e39d772b701bc42f38f891c0db1454006e14096f448201303e08c","artifact_id":"unicode-normalization","artifact_version":"17.0.0"},{"artifact_digest":"27d2e0c93fc654d75aad903c6d6b13c1de369d7546637f1142fd65bacd9fb4f0","artifact_id":"contentmd.generic-language-lexicon.en","artifact_version":"0.1.0"},{"artifact_digest":"3bd357502267304a2927752043e533cdb3c5ee2a492915604db00d5f778248d1","artifact_id":"contentmd.task4-candidate-rule-set.36968edb424cb94bfde37f0f623e70155f0e1bcf2bfa7dfce62c97a591757248","artifact_version":"0.1.0"},{"artifact_digest":"ba62a38d7c87d477c208946006df6e918612420838297fea47c0792300c063ff","artifact_id":"unicode-grapheme-break","artifact_version":"17.0.0"},{"artifact_digest":"beeefc0e74d41da3eb66754dc80252477884b8169e013217cc94ba0255b8edb5","artifact_id":"unicode-casefold","artifact_version":"17.0.0"},{"artifact_digest":"d06a843c2c03d183e00bebd98838b200ef9993b53c54d19c0f5b6e5ab7c0ac5e","artifact_id":"contentmd.task4-feature-universe-manifest.72fa697a301eedb276fec7b846111cab71e47673dd888c23414ba1662b9cb01a","artifact_version":"0.1.0"},{"artifact_digest":"eef23dc9f2e6c1dcd46201291758d07f400d834e24076e2bc4beb451ae526696","artifact_id":"contentmd.feature-source-runtime-profile","artifact_version":"0.1.0"}]},"provenance":[{"content_digest":"eef23dc9f2e6c1dcd46201291758d07f400d834e24076e2bc4beb451ae526696","record_id":"artifact.contentmd.feature-source-runtime-profile.0.1.0","relationship":"task4_feature_artifact_runtime_profile"},{"content_digest":"27d2e0c93fc654d75aad903c6d6b13c1de369d7546637f1142fd65bacd9fb4f0","record_id":"artifact.contentmd.generic-language-lexicon.en.0.1.0","relationship":"task4_feature_artifact_generic_lexicon"},{"content_digest":"3bd357502267304a2927752043e533cdb3c5ee2a492915604db00d5f778248d1","record_id":"artifact.contentmd.task4-candidate-rule-set.36968edb424cb94bfde37f0f623e70155f0e1bcf2bfa7dfce62c97a591757248.0.1.0","relationship":"task4_feature_artifact_hard_rule_set"},{"content_digest":"d06a843c2c03d183e00bebd98838b200ef9993b53c54d19c0f5b6e5ab7c0ac5e","record_id":"artifact.contentmd.task4-feature-universe-manifest.72fa697a301eedb276fec7b846111cab71e47673dd888c23414ba1662b9cb01a.0.1.0","relationship":"task4_feature_artifact_feature_universe"},{"content_digest":"beeefc0e74d41da3eb66754dc80252477884b8169e013217cc94ba0255b8edb5","record_id":"artifact.unicode-casefold.17.0.0","relationship":"task4_feature_artifact_unicode_casefold"},{"content_digest":"ba62a38d7c87d477c208946006df6e918612420838297fea47c0792300c063ff","record_id":"artifact.unicode-grapheme-break.17.0.0","relationship":"task4_feature_artifact_unicode_grapheme_break"},{"content_digest":"20713609c69e39d772b701bc42f38f891c0db1454006e14096f448201303e08c","record_id":"artifact.unicode-normalization.17.0.0","relationship":"task4_feature_artifact_unicode_normalization"},{"content_digest":"1d45af3473c7df9cb80d73dff29c7f03cd63ff217788e327dcb164713a5a0c0f","record_id":"artifact.unicode-whitespace.17.0.0","relationship":"task4_feature_artifact_unicode_whitespace"},{"content_digest":"128391f02a63e52b4d1dabfe3f12e06e4c40ff2059f932a6555c0cc5fe82f693","record_id":"artifact.unicode-word-break.17.0.0","relationship":"task4_feature_artifact_unicode_word_break"}],"record_id":"feature-profile.a2fc67839565ec8b77687c5a595e8952cac96a482d1859c788009c76d48b246e","record_version":1,"schema_id":"contentmd.feature-profile","schema_version":"0.1.0","scope":{"data_classes":["learning_feature_profile"],"memory_scope":"project","project_id":"project.task2.fixture","resource_refs":["feature-universe-manifest.5660ae4230d6ab79477d843cace83b4f0f252d7a783ef8875129df5119efd70b"]}}
